{
  "schema_version": "v3",
  "review_id": "catalogue-review.dolved-care-engineering.v3-foundation",
  "review_version": "1",
  "benchmark_id": "dolved-care-engineering",
  "corpus_version": "3",
  "taxonomy": {
    "taxonomy_id": "dolved-care-engineering-taxonomy",
    "taxonomy_version": "1",
    "taxonomy_sha256": "4f4d17654f2a510a70b640abf794ddefd1e5b84990c150f5a3dff9a7bf203af5"
  },
  "parent_benchmark_digest": "aabeb8c444fc5af7642d894e2f786eb684e663efe17bb702512d609a2701286d",
  "organisation_sha256": "87cc3601c63466c7ffb5ee8addcf933a4ebce06c84b0ed2e9efcf27df3fa8b3a",
  "document_catalog_sha256": "6a2d112eab795deffd8390674c34fcf26d645f2b50aa61af60646be45e024679",
  "source_digests": {
    "documents/complaints/advocacy-contacts.md": "64a8b2ffc093cb70d839152b2cc7bf63db94f47c25274a31f49b6d48fe4e17a5",
    "documents/complaints/complaint-record-form.md": "fb322ac36b3719418d345210094f5a685f608bfdae290f79066b316e0a5b778c",
    "documents/complaints/duty-of-candour.md": "1caad3698bff6f4de86f07ea82c8173c09a1c794cc104781d04f99c132ef3ad8",
    "documents/complaints/feedback-procedure.md": "dabe22ea37e8c2a18a02f13648f7f8834b087df33f0a3d3b2c6dd577be24b3b3",
    "documents/complaints/handling-v1.md": "03cce40d44fc007bffdb93f558349c0293a6c58a8956dfc08589ead38a4a869c",
    "documents/complaints/handling-v2.md": "2c1ff87df715203920ba962d461306c98a2219569fd3d56ae7830aa8e9f24572",
    "documents/fire-safety/fire-drills-v1.md": "b68d4a2856b4661d75cac0c8423e8ffd6c7d52a9491a9b9ef787e01a9e11ad3f",
    "documents/fire-safety/fire-drills-v2.md": "f5efae5749b9d5caf476bbac23efd724508692a10a4e35c5d80ed670f7150a4a",
    "documents/fire-safety/harbour-view-evacuation.md": "c6fd853ec681f0edb8f578bc2aa28f4243a1c923d6fe1cf680b448bcd16c8bda",
    "documents/fire-safety/midlands-evacuation.md": "8efe73c9a44881368622914e712ab72957a6bfa57080124f0aa954c7177dfad4",
    "documents/fire-safety/north-west-evacuation.md": "7cb7da4c5f03593c0b17f50e37d8a5b6558e41e8b9fdc0a8f550b7995594908b",
    "documents/fire-safety/peep-v1.md": "7dcea90d80bab85405cefd679af4495063188356722840da7c339ee182dd8850",
    "documents/fire-safety/peep-v2-scheduled.md": "e6ebd698be2bccc4e27eea9c6feff271070fcd152bc9e464f81265ad70e2b5c3",
    "documents/fire-safety/south-west-evacuation.md": "9fb4e06e5ef378c10aa935ac026b944461544b72f24b50db3a15e344e03bdd13",
    "documents/gdpr/cctv-access-request-form.md": "1d4b11dd1dde063ea3721dd4e7c1f16d31ca73ddd7f72daa3a884e5bb0fefa92",
    "documents/gdpr/data-protection-v1.md": "3ded992a7bb0bda8d153fd47843766355ca257ea1932ad3dac5302d5fccff7fc",
    "documents/gdpr/data-protection-v2.md": "c6fee6d32a596d2ab9ad9e85d506d5b35c4237e828f3c99af071f1acdde378d6",
    "documents/gdpr/personal-data-breach.md": "2405edb574a452cad38b6a1413f989907cbbed98171f7f7d634bd1ffea39a488",
    "documents/gdpr/records-retention-schedule.md": "081d06e52db3b27b953858d10f339d0208776ca02f1f92ae5992e1777a41dfb3",
    "documents/gdpr/subject-access-v1.md": "5b8f3232a82ef5927d1c34fc57960597d21909cf74c6f0c0162a38adc2052ef5",
    "documents/gdpr/subject-access-v2-scheduled.md": "14d62dd16227c2eb564ec2cf812878e609c27d596f573f22d37f2b644e14e7a1",
    "documents/health-safety/accident-reporting-v1.md": "b93211f822ffdf842d8630eeb8bc1b4c87ceb034f99619a33c56c4b952e579f9",
    "documents/health-safety/accident-reporting-v2.md": "b15f28bc72f6ad57c96373880899e3017ac6239996d35cf0c6ffc6a58ed7bce6",
    "documents/health-safety/coshh-procedure.md": "711afe04cbab9fa4c317b17d89f27547332c72c6bf288ad8202d89b635c84a82",
    "documents/health-safety/equipment-inspection-schedule.md": "cb700bc5a827da64b527b5f3bca78a51b95da7f99d962afeb3b28a16133b23d2",
    "documents/health-safety/lone-working-policy.md": "a5f23b4951e14faf4fcd6de5b0e5d95c1a5a68241502dd518b4ae857a42c75d3",
    "documents/health-safety/moving-handling-v1.md": "ef6c53d1866776ba9b00f8b47efcd1cdfd9fc36e1c6688a3addeae848ec750ff",
    "documents/health-safety/moving-handling-v2.md": "b02927ff66913948b52720fe33b30935ddb22972762b811cfb39ba5a94386cbf",
    "documents/health-safety/slips-trips-procedure.md": "ffcf7a3177ec7546a064ceee0dec144e7adb82d900a1a4513380da43c216f74f",
    "documents/health-safety/workplace-risk-assessment-form.md": "f6abe7c6d3cdab3c0aaa1b652cec916f2c75a2551458e1087c08102dd81705bb",
    "documents/hr/annual-leave-v1.md": "f38ec75b265ee85af5a37974503c70ddb60ab346e1558c4c9be5236b372fa8f5",
    "documents/hr/annual-leave-v2.md": "e45f0f5dd7b602d7a88202bbb43e142c44a57814e846e8ab7f228025bfd6114a",
    "documents/hr/annual-leave-v3-scheduled.md": "9c2f771f15476fa0b442708331ab7e40b65931b969829086c807b2850d5577fd",
    "documents/hr/disciplinary-policy.md": "ea881fdefe99e98bbbb97e66cfb1f3b7e1560ccaeeb78e174e2388bb9af146cb",
    "documents/hr/family-leave-reference.md": "c2f9c4b71d49013866d0050f5a9ff8fb699d5086013274ad509313c94f8036ed",
    "documents/hr/flexible-working-procedure.md": "01812c96f2049c8a82e53c5aab3057de42c4eb5898b005a7c91091df3dd40611",
    "documents/hr/grievance-procedure.md": "1ab34bdb587bcd48ae7a8e564e1ad401a5964421462d49aa801d841cee10b051",
    "documents/hr/midlands-lone-worker-welfare.md": "8953f8fe0d511dd93957ff9f60a19862bae278a77af05637ccef5b50409797e1",
    "documents/hr/new-starter-information-form.md": "8ba2d0b51fc877cfe809b9794aad72586cd3505d391c63fea4ba29a0dab85f09",
    "documents/hr/safer-recruitment-policy.md": "2b05162ce6c811ee40543723745b55e524bc7c9c29a72cbb6c008351975b824d",
    "documents/hr/sickness-absence-v1.md": "8c7ccf1f6fc96bcc1014c779fcb112a007c2b240a47ce027d165a7266163e864",
    "documents/hr/sickness-absence-v2.md": "51dc20f7807f09d6923a2ac8e42794ea075d783b70c096ffb50c7d6f6467f685",
    "documents/infection-control/clinical-waste-procedure.md": "d31b1c9d3a96635e4f6ec8249bf935d4d91db7a400f131742e8ba2782b969de9",
    "documents/infection-control/hand-hygiene-v1.md": "37618e099da6704d233c97ccf267b27ebf601e31624d87258aa1a2394c57c155",
    "documents/infection-control/hand-hygiene-v2.md": "d1c503fe4740d547e6cca6433c0bb45d74c0015e877953537367f098c651f599",
    "documents/infection-control/isolation-risk-assessment.md": "4a9864a51a5cbb53f8cac087fcfdeffe2d8bc91628c3d3fd6ff39b23b79f8faf",
    "documents/infection-control/laundry-procedure.md": "4e561f6ff4946854e3bd3d107e794aec92ecd817ae645d2e9cbfdd48d5c97853",
    "documents/infection-control/outbreak-management-v1.md": "5514341b895f892fa0af797eb14571266ea6ec8c1de53ca509aeb2e06eaa904c",
    "documents/infection-control/outbreak-management-v2-withdrawn.md": "cc265374341f019510bffaef17f288fc76be5a06c8bf3d29dcacf64e9fa71214",
    "documents/infection-control/ppe-reference.md": "a7f4e9022d343c4d748ac3bf753870420e88041a7eabcefa3891014231680a61",
    "documents/infection-control/respiratory-ppe-procedure.md": "d7afa21216322ee9ba0cff8fd5fb5723616513579016b1c9ff58e09e3186bb63",
    "documents/medication/controlled-drugs-v1.md": "d5787e6cd6a4d352a73dd57046f2a5d2e0f18f27af469cd2e279e4e87229f83b",
    "documents/medication/controlled-drugs-v2.md": "2dad915e9dfe6775c424b684abd53a3477e0aba31ab1c1baca06e91ad9644b31",
    "documents/medication/covert-administration-policy.md": "f7823fca89244a7d0526d7e7cc30346099f07e545bc08c9e33a982ea67e4a13b",
    "documents/medication/fridge-monitoring-reference.md": "a0bac45631e864fc283b189f5a41577493cbf20f64f9127401587d92cbadabd3",
    "documents/medication/medication-error-form.md": "2b8c66fe8861e482300eec8e1401806bba4a7c96e743aa38d4d5ca6b05afe3ae",
    "documents/medication/prn-protocol.md": "97bd45c6664615212ea9b17cce08404d4630617f638c43ce00c9ca4361bbf98d",
    "documents/medication/safe-administration-v1.md": "eb941e3a04dceabc1c694c3b84bcbad5a2f383748177c87343a9202c5c8ed696",
    "documents/medication/safe-administration-v2.md": "997cd45a57cdabde57b4a800fcbd855752f9aebb57849c8f1d84c75475b9a696",
    "documents/medication/safe-administration-v3.md": "3940ec1d3a35404458951111a9a1d3c449a29e75f6b9d59e88b6c01b30f68b46",
    "documents/medication/self-administration-risk-assessment.md": "d462a76b01ab635ec25c284b1cb95dfa9962562215d1e66a711591a9c936f0bf",
    "documents/medication/storage-temperature-procedure.md": "52e87ef6decfbcc35d347942d54087837cdf64e5b3d746a03f8b42af680eb436",
    "documents/payroll/calendar-2026.md": "8c890abd3864d458bf83e56fa589154d962f037b6787ec9f84110fa5cb6dc1a4",
    "documents/payroll/calendar-2027-scheduled.md": "f016b3444abfbdf2a2190796d76c62527b53447d9f5b6169b892e7c7da72617b",
    "documents/payroll/expenses-procedure.md": "0356b9e5a94ead0e9c2488374a488ef0a7ced63880767d64546901e5d2aae336",
    "documents/payroll/mileage-claim-form.md": "5984fdafbd24fc8338a9d147be2e6877dc54f6c0fb1a6113d5bf1bddf9ca5078",
    "documents/payroll/overtime-procedure.md": "6ed7e400c01eb8ad1d5da42cc18d411bbb104132e0c65cd54cbec67a14d01225",
    "documents/payroll/pension-reference.md": "020f6b7d4066c5f1a4bf31ef4c94f7d764f589255cf655feef605331d6504a7d",
    "documents/reference/care-abbreviations.md": "1c9becfbc579532ea5cc2863c4d38ab2d4ed6acc5ebfa38d8bb774737ed402b9",
    "documents/reference/emergency-numbers-2026.md": "c0cb89ea57d055a29bd0e7f9d6c27585e4ba82cce08f1304ddb4f063c0fe20db",
    "documents/reference/emergency-numbers-2027-scheduled.md": "1d7e0ab8b25e68980ac5a94f1fe748dbdd8a52ad7781d41cc5b4b2302ad2db8b",
    "documents/reference/operational-contacts.md": "46d005dc5aa0f136fb041e0fff9f915d9934a60e6a87384a616b39a92045dde4",
    "documents/safeguarding/adult-reporting-v1.md": "41c5934872a2a9f9575879937d005730a7c87623ae9027cf96fa8b99735fccf2",
    "documents/safeguarding/adult-reporting-v2-withdrawn.md": "3b286913e7669ba7c64412dd1ac915b1f7374f0a4a798ccd12064f1dc17bb048",
    "documents/safeguarding/allegations-staff-v1.md": "966ee4d265c08ab2edcb2cfb3d4a2843bc43c4ebbad52cbc9f2d9e46aacadf56",
    "documents/safeguarding/allegations-staff-v2.md": "74e8fb3800295c728de50f5c68ff967e996f3bbf95aebf4e3f7c50de4d00358f",
    "documents/safeguarding/body-map-form.md": "fd4bebf3cc6a1c2f0e74738ef7e6cc7f1fd73ddb99abfe64d90cd88a1b635dd0",